{
  "meta": {
    "dataset": "yardsticks",
    "schema": "schemas/yardsticks.schema.json",
    "as_of": "2026-10-25",
    "version": "1.0.0",
    "description": "Site-wide yardsticks (file 20 §3, §5.2): formula over figure ids, recomputed value, and the value published in file 20.",
    "conventions": "Decimal points and no thousands separators in JSON numbers; French formatting (comma decimal, narrow no-break space) is applied at render time. EUR bn = billions of euros, current prices. Every share says % of GDP or % of total public expenditure."
  },
  "parameters": [
    {
      "id": "days_in_year",
      "value": 365,
      "label_en": "Days in the reference year (2025)",
      "label_fr": "Jours dans l'année de référence (2025)",
      "notes": "File 20 §3.1 divides by 365."
    },
    {
      "id": "seconds_per_day",
      "value": 86400,
      "label_en": "Seconds per day",
      "label_fr": "Secondes par jour",
      "notes": null
    },
    {
      "id": "household_monthly_income_eur",
      "value": 3000,
      "label_en": "Monthly income of the reference household (design choice)",
      "label_fr": "Revenu mensuel du ménage de référence (choix éditorial)",
      "notes": "File 20 §3.2: scale factor = EUR 36,000 / EUR 1,562.5 bn of revenue. Chip [[yard:household_monthly_income_eur]] resolves to this parameter: chips resolve against yardsticks[] first, then parameters[] (validate.py checks it). Mention: illustratif (editorial choice, not a statistic)."
    },
    {
      "id": "months_per_year",
      "value": 12,
      "label_en": "Months per year",
      "label_fr": "Mois par an",
      "notes": null
    },
    {
      "id": "maastricht_deficit_limit_pct",
      "value": 3,
      "label_en": "Maastricht deficit reference value",
      "label_fr": "Valeur de référence du déficit (Maastricht)",
      "notes": "Treaty reference value, % of GDP (file 20 §5.2 goal B)."
    },
    {
      "id": "example_cut_eur_bn",
      "value": 30,
      "label_en": "Illustrative cut used in the macro-feedback explainer",
      "label_fr": "Baisse illustrative utilisée dans l'explication du bouclage macroéconomique",
      "notes": "File 20 §4.18 ('about 1 point of GDP')."
    }
  ],
  "conversions": {
    "one_day_spending_eur_bn": "te_2025_eur_bn / 365",
    "deficit_eur_bn": "deficit_2025_eur_bn",
    "population_m": "population_2025_m",
    "te_eur_bn": "te_2025_eur_bn",
    "gdp_eur_bn": "gdp_2025_eur_bn",
    "formulas_note": "days_of_spending = EUR bn / one_day_spending_eur_bn; pct_of_deficit = EUR bn / deficit_eur_bn x 100; eur_per_inhabitant = EUR bn x 1000 / population_m; pct_of_total_spending = EUR bn / te_eur_bn x 100; pct_of_gdp = EUR bn / gdp_eur_bn x 100. 2026-2027 amounts are set against 2025 denominators: orders of magnitude (file 16 header)."
  },
  "yardsticks": [
    {
      "id": "one_day_spending_eur_bn",
      "label_en": "One day of public spending (2025)",
      "label_fr": "Une journée de dépense publique (2025)",
      "formula": "te_2025_eur_bn / days_in_year",
      "value": 4.6962,
      "unit": "EUR bn per day",
      "display_decimals": 2,
      "store_decimals": 4,
      "published_in_file20": {
        "value": 4.7,
        "text": "EUR 4.70 bn",
        "section": "§3.1"
      },
      "figure_ids": [
        "te_2025_eur_bn"
      ],
      "checks_figure_id": null,
      "date_from_day_of_year": null,
      "notes": "Proposal conversions divide by the unrounded value (4.696)."
    },
    {
      "id": "te_per_capita_eur",
      "label_en": "Public spending per inhabitant (2025)",
      "label_fr": "Dépense publique par habitant (2025)",
      "formula": "te_2025_eur_bn * 1000 / population_2025_m",
      "value": 24842.7491,
      "unit": "EUR per inhabitant per year",
      "display_decimals": 0,
      "store_decimals": 4,
      "published_in_file20": {
        "value": 24843,
        "text": "EUR 24,843 per year",
        "section": "§3.1"
      },
      "figure_ids": [
        "te_2025_eur_bn",
        "population_2025_m"
      ],
      "checks_figure_id": "te_per_capita_2025_eur",
      "date_from_day_of_year": null,
      "notes": null
    },
    {
      "id": "te_per_capita_per_day_eur",
      "label_en": "Public spending per inhabitant per day (2025)",
      "label_fr": "Dépense publique par habitant et par jour (2025)",
      "formula": "te_per_capita_eur / days_in_year",
      "value": 68.0623,
      "unit": "EUR per inhabitant per day",
      "display_decimals": 0,
      "store_decimals": 4,
      "published_in_file20": {
        "value": 68.1,
        "text": "EUR 68.1 per day",
        "section": "§3.1"
      },
      "figure_ids": [],
      "checks_figure_id": null,
      "date_from_day_of_year": null,
      "notes": null
    },
    {
      "id": "deficit_days",
      "label_en": "The 2025 deficit in days of public spending",
      "label_fr": "Le déficit 2025 en jours de dépense publique",
      "formula": "deficit_2025_eur_bn / one_day_spending_eur_bn",
      "value": 32.2817,
      "unit": "days",
      "display_decimals": 1,
      "store_decimals": 4,
      "published_in_file20": {
        "value": 32.3,
        "text": "32.3 days",
        "section": "§3.1"
      },
      "figure_ids": [
        "deficit_2025_eur_bn"
      ],
      "checks_figure_id": null,
      "date_from_day_of_year": null,
      "notes": null
    },
    {
      "id": "borrowing_starts_day",
      "label_en": "Day of the year from which spending is financed by borrowing (calendar overlay)",
      "label_fr": "Jour de l'année à partir duquel la dépense est financée par l'emprunt (calendrier)",
      "formula": "days_in_year - deficit_days",
      "value": 332.7183,
      "unit": "days elapsed since 1 January",
      "display_decimals": null,
      "store_decimals": 4,
      "published_in_file20": {
        "value": null,
        "text": "from about 29 November",
        "section": "§3.1"
      },
      "figure_ids": [],
      "checks_figure_id": null,
      "date_from_day_of_year": 2025,
      "notes": "value_date = 1 January 2025 + floor(value) days.",
      "value_date": "2025-11-29"
    },
    {
      "id": "deficit_per_second_eur",
      "label_en": "Deficit per second (illustrative)",
      "label_fr": "Déficit par seconde (illustratif)",
      "formula": "deficit_2025_eur_bn * 1000000000 / (days_in_year * seconds_per_day)",
      "value": 4807.2045,
      "unit": "EUR per second",
      "display_decimals": -2,
      "store_decimals": 4,
      "published_in_file20": {
        "value": 4800,
        "text": "about EUR 4,800 per second",
        "section": "§3.1"
      },
      "figure_ids": [],
      "checks_figure_id": null,
      "date_from_day_of_year": null,
      "notes": "Caveat: the deficit is not the change in debt (stock-flow adjustments)."
    },
    {
      "id": "share_te_borrowed_pct",
      "label_en": "Share of public spending financed by borrowing (2025)",
      "label_fr": "Part de la dépense publique financée par l'emprunt (2025)",
      "formula": "deficit_2025_eur_bn / te_2025_eur_bn * 100",
      "value": 8.8443,
      "unit": "% of total public expenditure",
      "display_decimals": 1,
      "store_decimals": 4,
      "published_in_file20": {
        "value": 8.8,
        "text": "8.8%, about 1 euro in 11",
        "section": "§3.1"
      },
      "figure_ids": [],
      "checks_figure_id": "share_te_borrowed_2025_pct",
      "date_from_day_of_year": null,
      "notes": null
    },
    {
      "id": "borrowed_one_euro_in",
      "label_en": "Borrowed euros: '1 euro in N'",
      "label_fr": "Euros empruntés : « 1 euro sur N »",
      "formula": "te_2025_eur_bn / deficit_2025_eur_bn",
      "value": 11.3067,
      "unit": "N",
      "display_decimals": 0,
      "store_decimals": 4,
      "published_in_file20": {
        "value": 11,
        "text": "about 1 euro in 11",
        "section": "§3.1"
      },
      "figure_ids": [],
      "checks_figure_id": null,
      "date_from_day_of_year": null,
      "notes": null
    },
    {
      "id": "debt_per_capita_eur",
      "label_en": "Public debt per inhabitant (end-2025)",
      "label_fr": "Dette publique par habitant (fin 2025)",
      "formula": "debt_2025_eur_bn * 1000 / population_2026_01_01_m",
      "value": 50064.8879,
      "unit": "EUR per inhabitant",
      "display_decimals": 0,
      "store_decimals": 4,
      "published_in_file20": {
        "value": 50065,
        "text": "EUR 50,065",
        "section": "§3.1"
      },
      "figure_ids": [
        "debt_2025_eur_bn",
        "population_2026_01_01_m"
      ],
      "checks_figure_id": "debt_per_capita_2025_eur",
      "date_from_day_of_year": null,
      "notes": null
    },
    {
      "id": "debt_to_revenue_years",
      "label_en": "Debt in years of total revenue",
      "label_fr": "Dette en années de recettes publiques",
      "formula": "debt_2025_eur_bn / total_revenue_2025_eur_bn",
      "value": 2.2145,
      "unit": "years",
      "display_decimals": 1,
      "store_decimals": 4,
      "published_in_file20": {
        "value": 2.2,
        "text": "2.2 years of revenue",
        "section": "§3.1"
      },
      "figure_ids": [],
      "checks_figure_id": null,
      "date_from_day_of_year": null,
      "notes": null
    },
    {
      "id": "interest_to_revenue_pct",
      "label_en": "Interest as a share of total revenue (2025)",
      "label_fr": "Intérêts en part des recettes publiques (2025)",
      "formula": "interest_2025_eur_bn / total_revenue_2025_eur_bn * 100",
      "value": 4.2048,
      "unit": "% of total revenue",
      "display_decimals": 1,
      "store_decimals": 4,
      "published_in_file20": {
        "value": 4.2,
        "text": "4.2%",
        "section": "§3.1"
      },
      "figure_ids": [],
      "checks_figure_id": null,
      "date_from_day_of_year": null,
      "notes": null
    },
    {
      "id": "po_per_capita_eur",
      "label_en": "Compulsory levies per inhabitant (2025)",